{
  "answer": {
    "number": 0.8
  },
  "checks": [
    {
      "detail": "the computed answer is inside the kind's stated range",
      "kind": "frequency_bounds",
      "pass": true
    }
  ],
  "derivation_ref": "pokergto.odds#minimum_defense_frequency",
  "generator": {
    "function": "_answer",
    "module": "tools/gen_quizzes.py",
    "seed": 20261007
  },
  "id": "quiz.02-03.mdf-by-size-04",
  "lesson": "02-03",
  "parameters": {
    "bet": 3,
    "kind": "minimum-defense-frequency",
    "pot": 12
  },
  "prompt": {
    "en": "The pot is 12 and the opponent bets 3. What share of your range must you continue with so that a bluff with any two cards does not profit?",
    "zh": "底池 12，对手下注 3。你的范围至少要防守多大比例，才让对手的任何两张牌诈唬都不赚？"
  },
  "provenance": {
    "assumptions": [
      {
        "en": "The item's inputs are drawn from the authored domain; no population frequency or opponent model is involved.",
        "zh": "题目的输入来自作者设定的取值域；不涉及任何人群频率或对手模型。"
      }
    ],
    "confidence": "high",
    "derivation_ref": "pokergto.odds#minimum_defense_frequency",
    "kind": "derived",
    "license": "CC-BY-SA-4.0",
    "solver_run": null,
    "upstream": null,
    "verified": true
  },
  "rationale": {
    "en": "MDF = P/(P+B) = 12/(12+3); the answer is computed by pokergto.odds#minimum_defense_frequency, not typed in.",
    "zh": "MDF = P/(P+B) = 12/(12+3)；答案由 pokergto.odds#minimum_defense_frequency 算出，不是填进去的。"
  },
  "schema_version": "1.0.0",
  "tolerance": {
    "absolute": 5e-05,
    "relative": null
  },
  "type": "numeric"
}
